name,number
"Live Unplugged Melodies Near Icic Bank Kandivali West, mumbai",07947185294
"Mujtaba Aziz Naza & Entertainments Behind Cafe Simla Oshiwara, mumbai",07947328374
"Aj Creative Events  Lokhandwala Complex andheri West, mumbai",07947168790
"Live Singing Guitarist & Band Performance By Abhisshhek Shankar Behind Ackruti Trade Centre Andheri East, Mumbai",07947444754
"Arc9 Production Besides New Life Hospital Ghansoli, Mumbai",
"MW Studio Opp Manubhai Jewellers Borivali West, mumbai",07947170189
"Dholi Brothers Mumbai Oppsingh Sabha Gurudwara Sion, Mumbai",07947466032
"Powai Pooja Paath Vidhi Kendra  Andheri East, mumbai",07947261315
"Sanjay Events & Sejal Sound Near Sapna Garden Ulhasnagar No 3, Mumbai",07947174260
"Songsmith Talent Management Manish Nagar Four Bungalows Andheri West, Mumbai",07942775738
